{
  "openpkg": "0.2.0",
  "meta": { "name": "my-sdk", "version": "2.0.0" },
  "exports": [
    {
      "id": "createClient",
      "name": "createClient",
      "kind": "function",
      "signatures": [{
        "parameters": [
          { "name": "url", "required": true },
          { "name": "apiKey", "required": true }
        ]
      }]
    },
    {
      "id": "fetchData",
      "name": "fetchData",
      "kind": "function",
      "signatures": [{
        "parameters": [
          { "name": "client", "required": true },
          { "name": "endpoint", "required": true },
          { "name": "options", "required": false }
        ]
      }]
    },
    {
      "id": "createWebhook",
      "name": "createWebhook",
      "kind": "function",
      "signatures": [{
        "parameters": [
          { "name": "url", "required": true },
          { "name": "events", "required": true }
        ]
      }]
    }
  ],
  "docs": { "coverageScore": 80 }
}

